{
  "schemaVersion": "1.0.0",
  "projectId": "PRJ-REAL-APT-0001",
  "researchId": "PRICE-RESEARCH-PRJ-REAL-APT-0001-TILE-WATERPROOF-001",
  "researchName": "PRJ-REAL-APT-0001 타일/부자재/방수재 단가 조사",
  "status": "NEEDS_RESEARCH",
  "approvalPolicy": {
    "masterDbDirectUpdateAllowed": false,
    "approvalRequiredBeforeMasterDbUpdate": true,
    "approvalRequestType": "MasterDbUpdateRequest",
    "rollbackRequired": true,
    "approvedBy": "CEO"
  },
  "items": [
    {
      "projectId": "PRJ-REAL-APT-0001",
      "itemId": "TILE-WALL-001",
      "itemName": "벽타일",
      "category": "Tile",
      "subcategory": "wall_tile",
      "standardSpec": "욕실/주방 벽 적용 표준 규격 NEEDS_RESEARCH",
      "unit": "m2",
      "quantityBasis": "시공 면적 기준, 손실률 별도",
      "officialPrice": "NEEDS_RESEARCH",
      "marketPrice": "NEEDS_RESEARCH",
      "supplierPrice": "NEEDS_RESEARCH",
      "internalPrice": "NEEDS_RESEARCH",
      "laborCost": "NEEDS_RESEARCH",
      "accessoryCost": "NEEDS_RESEARCH",
      "wasteRate": "NEEDS_RESEARCH",
      "minimumOrderUnit": "NEEDS_RESEARCH",
      "leadTimeDays": "NEEDS_RESEARCH",
      "paymentCondition": "NEEDS_RESEARCH",
      "preferredSupplier": "NEEDS_RESEARCH",
      "alternativeItems": ["자기질 벽타일", "도기질 벽타일", "포세린 벽타일"],
      "commonDefectRisk": ["들뜸", "줄눈 오염", "타일 파손", "색상 로트 차이"],
      "sourceType": "NEEDS_RESEARCH",
      "sourceName": "NEEDS_RESEARCH",
      "sourceDate": "NEEDS_RESEARCH",
      "confidenceLevel": "UNKNOWN",
      "updateCycle": "monthly_until_verified",
      "approvalStatus": "NEEDS_RESEARCH",
      "sourceCandidates": [
        {
          "sourceType": "official",
          "sourceName": "조달청 가격정보, 표준시장단가",
          "dataToCollect": ["officialPrice", "unit", "sourceDate"]
        },
        {
          "sourceType": "supplier",
          "sourceName": "타일 거래처/대리점",
          "dataToCollect": ["supplierPrice", "minimumOrderUnit", "leadTimeDays", "paymentCondition"]
        },
        {
          "sourceType": "market",
          "sourceName": "온라인 자재몰/도매몰",
          "dataToCollect": ["marketPrice", "shippingCondition", "stockStatus"]
        },
        {
          "sourceType": "internal",
          "sourceName": "ECOREAN 실제 구매/시공 기록",
          "dataToCollect": ["internalPrice", "actualWasteRate", "actualDefectRate"]
        }
      ],
      "estimateVsActualLink": {
        "enabled": true,
        "estimatedFields": ["supplierPrice", "laborCost", "accessoryCost", "wasteRate", "leadTimeDays"],
        "actualFields": ["actualPurchasePrice", "actualLaborCost", "actualWasteRate", "actualLeadTimeDays"],
        "varianceFields": ["priceVariance", "laborVariance", "wasteVariance", "deliveryVariance"]
      },
      "approvalFlow": {
        "nextStep": "CREATE_MASTER_DB_UPDATE_REQUEST",
        "approvalRequestType": "MasterDbUpdateRequest",
        "masterDbUpdateAllowedBeforeApproval": false,
        "rollbackRequired": true
      },
      "notes": "고객 선택 브랜드/규격에 따라 금액 차이가 커서 표준형과 고급형을 분리 조사한다."
    },
    {
      "projectId": "PRJ-REAL-APT-0001",
      "itemId": "TILE-FLOOR-001",
      "itemName": "바닥타일",
      "category": "Tile",
      "subcategory": "floor_tile",
      "standardSpec": "욕실/현관/발코니 바닥 적용 표준 규격 NEEDS_RESEARCH",
      "unit": "m2",
      "quantityBasis": "시공 면적 기준, 물매/배수구 컷팅 영향 별도",
      "officialPrice": "NEEDS_RESEARCH",
      "marketPrice": "NEEDS_RESEARCH",
      "supplierPrice": "NEEDS_RESEARCH",
      "internalPrice": "NEEDS_RESEARCH",
      "laborCost": "NEEDS_RESEARCH",
      "accessoryCost": "NEEDS_RESEARCH",
      "wasteRate": "NEEDS_RESEARCH",
      "minimumOrderUnit": "NEEDS_RESEARCH",
      "leadTimeDays": "NEEDS_RESEARCH",
      "paymentCondition": "NEEDS_RESEARCH",
      "preferredSupplier": "NEEDS_RESEARCH",
      "alternativeItems": ["논슬립 타일", "포세린 바닥타일", "자기질 바닥타일"],
      "commonDefectRisk": ["구배 불량", "배수 불량", "들뜸", "미끄럼"],
      "sourceType": "NEEDS_RESEARCH",
      "sourceName": "NEEDS_RESEARCH",
      "sourceDate": "NEEDS_RESEARCH",
      "confidenceLevel": "UNKNOWN",
      "updateCycle": "monthly_until_verified",
      "approvalStatus": "NEEDS_RESEARCH",
      "sourceCandidates": [
        {
          "sourceType": "official",
          "sourceName": "표준시장단가, 조달청 가격정보",
          "dataToCollect": ["officialPrice", "unit"]
        },
        {
          "sourceType": "supplier",
          "sourceName": "타일 거래처/대리점",
          "dataToCollect": ["supplierPrice", "leadTimeDays", "minimumOrderUnit"]
        },
        {
          "sourceType": "market",
          "sourceName": "온라인 자재몰/타일 도매몰",
          "dataToCollect": ["marketPrice", "deliveryFee"]
        },
        {
          "sourceType": "internal",
          "sourceName": "ECOREAN 실제 현장 기록",
          "dataToCollect": ["internalPrice", "actualWasteRate", "defectHistory"]
        }
      ],
      "estimateVsActualLink": {
        "enabled": true,
        "estimatedFields": ["supplierPrice", "laborCost", "wasteRate"],
        "actualFields": ["actualPurchasePrice", "actualLaborCost", "actualWasteRate"],
        "varianceFields": ["priceVariance", "laborVariance", "wasteVariance"]
      },
      "approvalFlow": {
        "nextStep": "CREATE_MASTER_DB_UPDATE_REQUEST",
        "approvalRequestType": "MasterDbUpdateRequest",
        "masterDbUpdateAllowedBeforeApproval": false,
        "rollbackRequired": true
      },
      "notes": "욕실 바닥은 방수/구배/배수구 조건과 함께 확인한다."
    },
    {
      "projectId": "PRJ-REAL-APT-0001",
      "itemId": "TILE-PORCELAIN-600-001",
      "itemName": "600각 포세린",
      "category": "Tile",
      "subcategory": "600_porcelain_tile",
      "standardSpec": "600x600 포세린 타일",
      "unit": "m2",
      "quantityBasis": "시공 면적 기준, 컷팅/로스/양중 별도",
      "officialPrice": "NEEDS_RESEARCH",
      "marketPrice": "NEEDS_RESEARCH",
      "supplierPrice": "NEEDS_RESEARCH",
      "internalPrice": "NEEDS_RESEARCH",
      "laborCost": "NEEDS_RESEARCH",
      "accessoryCost": "NEEDS_RESEARCH",
      "wasteRate": "NEEDS_RESEARCH",
      "minimumOrderUnit": "NEEDS_RESEARCH",
      "leadTimeDays": "NEEDS_RESEARCH",
      "paymentCondition": "NEEDS_RESEARCH",
      "preferredSupplier": "NEEDS_RESEARCH",
      "alternativeItems": ["600각 자기질", "대형 포세린", "수입 포세린"],
      "commonDefectRisk": ["평활도 불량", "단차", "컷팅 파손", "하중/양중 비용 증가"],
      "sourceType": "NEEDS_RESEARCH",
      "sourceName": "NEEDS_RESEARCH",
      "sourceDate": "NEEDS_RESEARCH",
      "confidenceLevel": "UNKNOWN",
      "updateCycle": "monthly_until_verified",
      "approvalStatus": "NEEDS_RESEARCH",
      "sourceCandidates": [
        {
          "sourceType": "supplier",
          "sourceName": "포세린 타일 대리점/도매상",
          "dataToCollect": ["supplierPrice", "brand", "origin", "leadTimeDays", "stockStatus"]
        },
        {
          "sourceType": "market",
          "sourceName": "온라인 타일몰",
          "dataToCollect": ["marketPrice", "deliveryFee", "boxUnit"]
        },
        {
          "sourceType": "internal",
          "sourceName": "시공팀 실제 품수 기록",
          "dataToCollect": ["laborCost", "actualProductivity", "actualWasteRate"]
        }
      ],
      "estimateVsActualLink": {
        "enabled": true,
        "estimatedFields": ["supplierPrice", "laborCost", "accessoryCost", "wasteRate"],
        "actualFields": ["actualPurchasePrice", "actualLaborCost", "actualAccessoryCost", "actualWasteRate"],
        "varianceFields": ["priceVariance", "laborVariance", "accessoryVariance", "wasteVariance"]
      },
      "approvalFlow": {
        "nextStep": "CREATE_MASTER_DB_UPDATE_REQUEST",
        "approvalRequestType": "MasterDbUpdateRequest",
        "masterDbUpdateAllowedBeforeApproval": false,
        "rollbackRequired": true
      },
      "notes": "600각은 레벨링 클립/접착재/시공 난이도와 함께 조사한다."
    },
    {
      "projectId": "PRJ-REAL-APT-0001",
      "itemId": "TILE-LARGE-001",
      "itemName": "대형타일",
      "category": "Tile",
      "subcategory": "large_format_tile",
      "standardSpec": "600각 초과 대형타일 NEEDS_RESEARCH",
      "unit": "m2",
      "quantityBasis": "면적 + 난이도 + 양중 + 컷팅 기준",
      "officialPrice": "NEEDS_RESEARCH",
      "marketPrice": "NEEDS_RESEARCH",
      "supplierPrice": "NEEDS_RESEARCH",
      "internalPrice": "NEEDS_RESEARCH",
      "laborCost": "NEEDS_RESEARCH",
      "accessoryCost": "NEEDS_RESEARCH",
      "wasteRate": "NEEDS_RESEARCH",
      "minimumOrderUnit": "NEEDS_RESEARCH",
      "leadTimeDays": "NEEDS_RESEARCH",
      "paymentCondition": "NEEDS_RESEARCH",
      "preferredSupplier": "NEEDS_RESEARCH",
      "alternativeItems": ["600각 포세린", "박판타일", "수입 대형타일"],
      "commonDefectRisk": ["파손", "단차", "들뜸", "양중비 증가", "시공 품수 증가"],
      "sourceType": "NEEDS_RESEARCH",
      "sourceName": "NEEDS_RESEARCH",
      "sourceDate": "NEEDS_RESEARCH",
      "confidenceLevel": "UNKNOWN",
      "updateCycle": "monthly_until_verified",
      "approvalStatus": "NEEDS_RESEARCH",
      "sourceCandidates": [
        {
          "sourceType": "supplier",
          "sourceName": "대형타일 전문 대리점",
          "dataToCollect": ["supplierPrice", "leadTimeDays", "minimumOrderUnit", "breakagePolicy"]
        },
        {
          "sourceType": "internal",
          "sourceName": "타일 시공팀",
          "dataToCollect": ["laborCost", "crewProductivity", "difficultyAdjust", "minimumLaborCharge"]
        }
      ],
      "estimateVsActualLink": {
        "enabled": true,
        "estimatedFields": ["supplierPrice", "laborCost", "wasteRate", "leadTimeDays"],
        "actualFields": ["actualPurchasePrice", "actualLaborCost", "actualWasteRate", "actualLeadTimeDays"],
        "varianceFields": ["priceVariance", "laborVariance", "scheduleVariance"]
      },
      "approvalFlow": {
        "nextStep": "CREATE_MASTER_DB_UPDATE_REQUEST",
        "approvalRequestType": "MasterDbUpdateRequest",
        "masterDbUpdateAllowedBeforeApproval": false,
        "rollbackRequired": true
      },
      "notes": "대형타일은 대표 승인 전 고객 견적 확정 금지."
    },
    {
      "projectId": "PRJ-REAL-APT-0001",
      "itemId": "TILE-SLAB-001",